Title,Ingredients,Instructions
['Chicken Korma Recipe'],"For chicken korma gravy▢ 1 to 2 tablespoon oil or ghee▢ 1 small  bay leaf (optional)▢ 4 cloves (optional)▢ 2 inch cinnamon (optional)▢ 1 cardamom (optional)▢ 1 to 2  green chilies slit or chopped (optional)▢ ½ cup hot water (more if needed)▢ ¼ teaspoon salt  (adjust to taste)▢ ½ to ¾ teaspoon garam masala▢ 1½ teaspoon coriander powder (ground coriander)▢ ¼ teaspoon Kashmiri red chili powder  (optional, for color)▢ 3 tablespoons coriander leaves (cilantro) chopped","▢ To the same pan, add oil and heat it.1 to 2 tablespoon oil or ghee▢ Optional – Saute whole spices – bay leaf, cinnamon stick, cloves and cardamom in oil for a min. ▢ Add green chilli and marinated chicken. Saute on a medium heat until the raw smell of ginger garlic paste goes away. This takes about 5 to 6 minutes.▢ Then add the onion nut puree. Pour hot water and mix well.½ cup hot water▢ Add salt, coriander powder and garam masala. If required you can also add more chili powder for color.▢ Mix well & raise the heat to bring to a boil. Reduce the heat. Cover and cook on a low flame until chicken is cooked to tender & you see traces of oil over the korma.▢ Cook further till the gravy reaches a desired consistency. If it is too thick then pour some hot water to bring it to consistency.▢ Garnish with coriander leaves.▢ Serve chicken korma with Jeera rice, plain Basmati Rice, Butter Naan, roti or paratha."
['Fish Curry Recipe'],For curry▢ 1 tbsp oil▢ 1 sprig  curry leaves or small bay leaf▢ 1 to 2 green chili  (chopped or slit)▢ 1 to 1 ½ tsp garam masala or curry powder as needed (refer notes)▢ 1¼ to 1½ cup water,"▢ Add 1 tbsp more oil to the same pot used earlier. Heat up on a low flame. ▢ When the oil turns slightly hot, add curry leaves & green chilies. ▢ When they splutter, add the ground onion tomato paste and garam masala. Taste test the paste and add more chilli powder at this stage if you want more heat or more deeper color.▢ Saute until the mixture smells good. ▢ Pour 1 ¼ to 1½ cup water. Mix and bring it to a boil. Cook until you see traces of oil on the surface and the gravy thickens a bit.▢ Gently slide the fish pieces and cook covered on a medium heat.▢ Carefully flip or turn the pieces to the other side after 3 to 4 mins.▢ Cook until the fish pieces bulge a bit. This is the indication they are cooked completely. Taste the curry and add more salt if needed.▢ Optionally garnish fish curry with coriander leaves if desired."
['Lamb Curry Recipe'],"▢ 2.2 lbs (1 Kg) bone-in lamb  (shoulder or leg cut or bone-less)▢ ¼  cup plain yogurt  (for substitutes read notes)▢ 2 to 3 teaspoons Kashmiri red chilli powder (adjust to taste, read notes)▢ ½ teaspoon turmeric▢ 2 to 3 teaspoons garam masala (or meat masala, adjust to taste, read notes)▢ ¾ to 1 teaspoon cumin powder▢ 1 tablespoon coriander powder▢ 2 teaspoon salt  (more to adjust)▢ 6 tablespoons oil  or ghee (divided, more if you prefer)▢ 1 bay leaf▢ 6 green cardamoms▢ 3 inch cinnamon piece▢ 2 black cardamom (optional)▢ 1 to 2 star anise (optional)▢ 2 cups onions fine chopped▢ 1½ cup (300 g) tomatoes (fresh tomatoes chopped or pureed or 1 cup bottled like passata)▢ 1 to 2 green chilli slit  ( deseeded, optional)▢ 2 tablespoon ginger garlic paste (or minced, divided equally)▢ 4 tablespoons mint leaves  (pudina, fine chopped)▢ 4 to 5 cup hot water  (cut down for boneless, adjust as needed)▢ ½ tablespoon kasuri methi  (dried fenugreeks leaves, optional)▢ ¼ cup coriander leaves  (fine chopped, optional)","▢ Meanwhile in another pan, heat the rest of the oil/ghee. Add the onions & green chilies. Saute on a medium heat for 6 to 7 mins.▢ Reduce the heat and stir fry for a few more minutes until deep golden but not burnt.▢ Add rest of the ginger garlic  & saute until the raw smell of ginger garlic goes away. This takes 1 to 2 minutes.▢ Turn off the heat & stir in the rest of the ground spices, immediately pour the tomato puree. Cook on a medium heat until the raw flavor of tomatoes is gone.▢ Transfer this to the lamb after 1 hour of cooking lamb. Cook covered on a low heat until the meat is fully cooked and fork tender, for another 50 mins or more. Pour more hot water if required as you cook & keep stirring often, every 5 to 7 mins.▢ Taste test and add more salt or garam masala & kasuri methi if needed. If you want more heat in your lamb curry, add some freshly crushed black pepper.▢ Garnish lamb curry with coriander leaves and serve with roti/ naan/ rice or with any artisan bread.▢ Lamb curry tastes best after resting for a few hours or even the next day. Reheat & adjust the salt when you are ready to serve."
['Rogan Josh Recipe (Lamb Rogan Josh)'],Spices (refer notes)▢ 1 bay leaf (skip if you don't have)▢ 3 to 4 cloves (or ¼ teaspoon ground cloves)▢ 1 inch cinnamon (or ¼ teaspoon ground cinnamon)▢ 3 green cardamoms (or ⅓ teaspoon ground cardamoms)▢ 1 black cardamom (skip if you don't have)▢ 2 teaspoon fennel seeds powder▢ 1 teaspoon dried ginger powder (or substitute 1 teaspoon ginger paste)▢ 1 teaspoon garam masala (optional),"▢ This step is optional. But it helps to thicken the rogan josh. Heat 1.5 tablespoons oil in a pan and saute shallots/onions on a medium heat until golden, about to caramelize but not burnt. Cool them and blend with 2 to 3 tablespoons of yogurt to a smooth paste. Keep this aside.▢ Heat oil or ghee in a heavy bottom pot and add bay leaf, green cardamoms, cinnamon, cloves and black cardamoms. (If you opt for the ground spices, add them later.)▢ When the spices begin to sizzle in oil, add mutton and sear it for 1 to 2 minute on a high heat.▢ Reduce the heat to medium and fry for another 4 to 5 minutes until the meat is slightly brown.▢ While you fry the meat, add yogurt to a mixing bowl. Also add ground spices – red chilli powder, fennel powder, dried ginger powder and salt. ▢ Whisk all of them well. If your yogurt is too thick (like Greek yogurt), add 3 to 4 tablespoons of water or stock and whisk it well until smooth.▢ Once the meat is light brown in color, add hing to the oil. Take the pot off the stove and slowly stir in the spice and yogurt mixture.▢ Mix well and place the pot back on the stove. Cook covered for 3 to 4 minutes on a medium heat. ▢ Pour 1 cup hot water or stock. Cook covered on a low heat until tender, adding more hot water if required.▢ Stir rogan josh every 7 to 8 minutes. When it is done, the mutton pieces should be soft, tender and fall off the bone. (Optional – During the last 20 minutes of cooking add the blended onion paste and mix well.)▢ The cook time depends on the kind of pot, source of heat and the intensity of heat. Do not forget to add more hot water (if required) as you cook.▢ The gravy in Rogan josh is neither too runny nor too thick but is slightly thick as the some of the bone marrow seeps into the liquids. This results can be achieved only by slow cooking the dish.▢ Taste test and add more salt or garam masala if required. Turn off the heat and rest for few hours before serving. This helps to develop the flavors.▢ Serve rogan josh with Tandoori Roti, Butter Naan, Basmati Rice, Paratha or Roti. It is best served with plain rice."
['Rogan Josh Recipe (Lamb Rogan Josh)'],Spices (refer notes)▢ 1 bay leaf (skip if you don't have)▢ 3 to 4 cloves (or ¼ teaspoon ground cloves)▢ 1 inch cinnamon (or ¼ teaspoon ground cinnamon)▢ 3 green cardamoms (or ⅓ teaspoon ground cardamoms)▢ 1 black cardamom (skip if you don't have)▢ 2 teaspoon fennel seeds powder▢ 1 teaspoon dried ginger powder (or substitute 1 teaspoon ginger paste)▢ 1 teaspoon garam masala (optional),"▢ This step is optional. But it helps to thicken the rogan josh. Heat 1.5 tablespoons oil in a pan and saute shallots/onions on a medium heat until golden, about to caramelize but not burnt. Cool them and blend with 2 to 3 tablespoons of yogurt to a smooth paste. Keep this aside.▢ Heat oil or ghee in a heavy bottom pot and add bay leaf, green cardamoms, cinnamon, cloves and black cardamoms. (If you opt for the ground spices, add them later.)▢ When the spices begin to sizzle in oil, add mutton and sear it for 1 to 2 minute on a high heat.▢ Reduce the heat to medium and fry for another 4 to 5 minutes until the meat is slightly brown.▢ While you fry the meat, add yogurt to a mixing bowl. Also add ground spices – red chilli powder, fennel powder, dried ginger powder and salt. ▢ Whisk all of them well. If your yogurt is too thick (like Greek yogurt), add 3 to 4 tablespoons of water or stock and whisk it well until smooth.▢ Once the meat is light brown in color, add hing to the oil. Take the pot off the stove and slowly stir in the spice and yogurt mixture.▢ Mix well and place the pot back on the stove. Cook covered for 3 to 4 minutes on a medium heat. ▢ Pour 1 cup hot water or stock. Cook covered on a low heat until tender, adding more hot water if required.▢ Stir rogan josh every 7 to 8 minutes. When it is done, the mutton pieces should be soft, tender and fall off the bone. (Optional – During the last 20 minutes of cooking add the blended onion paste and mix well.)▢ The cook time depends on the kind of pot, source of heat and the intensity of heat. Do not forget to add more hot water (if required) as you cook.▢ The gravy in Rogan josh is neither too runny nor too thick but is slightly thick as the some of the bone marrow seeps into the liquids. This results can be achieved only by slow cooking the dish.▢ Taste test and add more salt or garam masala if required. Turn off the heat and rest for few hours before serving. This helps to develop the flavors.▢ Serve rogan josh with Tandoori Roti, Butter Naan, Basmati Rice, Paratha or Roti. It is best served with plain rice."
['Mutton Curry | Mutton Masala Gravy'],Hot Water▢ ¾  cup hot water to cook in stovetop pressure cooker▢ 2 to 2½  cups hot water to cook in a regular pot/Dutch oven,"▢ On a low to medium flame, gently heat oil in a pan or pressure cooker. Add the whole spices – cinnamon, cardamoms and bay leaf (optional), followed by onions & green chilies.▢ Saute until onions turn golden. Lower the flame to very low as much as possible.  Then transfer the marinated mutton and saute for 5 to 7 mins.▢ Stir in the meat masala & curry leaves (optional), followed by pureed tomatoes.▢ Increase the heat to medium and saute for another 5 to 7 mins, until the raw flavor of tomatoes has reduced. Pour hot water & mix well.▢ To cook in a regular pot: Bring it to a gentle boil and cook covered on a medium heat for 1 hour 30 minutes. Stir well every 12 to 15 minutes and pour more hot water in batches as needed.▢ Stovetop Pressure Cooker: Pressure cook on a medium heat for 4 to 5 whistles, depending on the kind or cooker, meat and size of the mutton pieces. ▢ When the pressure drops, open the lid and mix well. If the curry is runny, cook/saute for a few more minutes to evaporate some of the moisture. Your mutton is cooked through when it is tender, flakes easily with a fork and falls off the bone easily. ▢ Taste the curry and add more salt if needed. If you feel it is low on flavor, you may sprinkle little garam masala. Garnish with fine chopped coriander leaves.▢ Serve mutton curry hot with rice, tandoori roti, naan or plain paratha."
['Mutton Curry | Mutton Masala Gravy'],Hot Water▢ ¾  cup hot water to cook in stovetop pressure cooker▢ 2 to 2½  cups hot water to cook in a regular pot/Dutch oven,"▢ On a low to medium flame, gently heat oil in a pan or pressure cooker. Add the whole spices – cinnamon, cardamoms and bay leaf (optional), followed by onions & green chilies.▢ Saute until onions turn golden. Lower the flame to very low as much as possible.  Then transfer the marinated mutton and saute for 5 to 7 mins.▢ Stir in the meat masala & curry leaves (optional), followed by pureed tomatoes.▢ Increase the heat to medium and saute for another 5 to 7 mins, until the raw flavor of tomatoes has reduced. Pour hot water & mix well.▢ To cook in a regular pot: Bring it to a gentle boil and cook covered on a medium heat for 1 hour 30 minutes. Stir well every 12 to 15 minutes and pour more hot water in batches as needed.▢ Stovetop Pressure Cooker: Pressure cook on a medium heat for 4 to 5 whistles, depending on the kind or cooker, meat and size of the mutton pieces. ▢ When the pressure drops, open the lid and mix well. If the curry is runny, cook/saute for a few more minutes to evaporate some of the moisture. Your mutton is cooked through when it is tender, flakes easily with a fork and falls off the bone easily. ▢ Taste the curry and add more salt if needed. If you feel it is low on flavor, you may sprinkle little garam masala. Garnish with fine chopped coriander leaves.▢ Serve mutton curry hot with rice, tandoori roti, naan or plain paratha."
