Title,Ingredients,Instructions
['Baingan Bharta Recipe (Eggplant Bharta)'],other ingredients▢ 1½ tablespoons oil (mustard oil or any other)▢ ½ cup (130 grams) onions (chopped)▢ ¾ cup (200 grams) tomato (deseeded & chopped)▢ 3 large garlic cloves (fine chopped)▢ ½ to ¾ inch ginger (fine chopped)▢ ½ teaspoon red chilli powder (adjust to taste)▢ ½ teaspoon garam masala (read notes)▢ ¾ teaspoon salt (adjust to taste)▢ 2 tablespoon coriander leaves (fine chopped),"▢ Pour oil to a hot pan. When the oil turns hot, add chopped ginger and garlic. ▢ Saute for 30 to 60 seconds until aromatic.▢ Then add chopped onions and saute until they turn light golden.▢ Add tomatoes and salt. Cook until they become soft. Then add red chili powder and cook for a few minutes until the raw smell from the tomatoes goes away.▢ Then mashed eggplants, garlic and green chilies. (You may want to save half of the green chilies for later after taste testing)▢ Mix everything and mash it a bit to blend well. Then add garam masala and cook for 3 to 4 minutes on a medium heat.▢ Taste test and add more salt and green chilli. Garnish with coriander leaves. If you like squeeze some lemon juice.▢ Serve baingan bharta with roti, rice or naan."
['Gobi Manchurian Recipe | Cauliflower Manchurian'],"To Make Gobi Manchurian Sauce▢ 1½ tablespoons oil (for sauce)▢ 1 tablespoon garlic fine chopped▢ ½ tablespoon ginger fine chopped▢ 1 green chili chopped (optional)▢ ⅓ cup onions or spring onions/ scallions fine chopped – green & white separated ▢ ¼ cup bell pepper  (capsicum chopped fine) (optional)▢ 1 tablespoon soya sauce (organic or naturally brewed)(or tamari)▢ 2 to 3 tablespoon Red Chilli sauce (or 2 tsps hot sauce, adjust to taste)▢ 1 to 2 tablespoon tomato ketchup (optional, use if using hot sauce)▢ ½  teaspoon Kashmiri red chili powder  (or paprika optional) ▢ ½ tablespoon rice vinegar (I used apple cider vinegar)▢ 1 teaspoon sugar (adjust to taste)▢ salt as needed▢ 3 to 4 tablespoons water▢ ½ to ¾ teaspoon black pepper crushed or ground▢ ⅛ teaspoon salt (adjust to taste)▢ 2 tablespoons spring onion greens chopped for garnish","▢ Optional: Mix together red chili powder with little water (1 tbsp) to a paste and keep aside. This step is optional and is used mainly for the red color.  ▢ Prepare the sauce: Add soya sauce, red chili sauce, tomato ketchup, red chili paste, sugar and vinegar to a small bowl and keep this aside. (for gravy version refer the notes section below). ▢ Heat oil in a wide pan or wok. Add garlic, ginger and green chilies. Saute for a minute or two. ▢ Then add spring onions whites & bell pepper. Saute them on a high flame for 2 mins. ▢ Pour the sauce and water. Mix well and cook stirring until the sauce turns thick. Add black pepper and turn off the heat.▢ Taste test and adjust the heat and salt levels to your taste. The sauce has to be slightly tangy, sweet & hot. If you want you may add more sauce to preference. ▢ Allow the sauce to cool for 1 to 2 mins. Add the fried cauliflower and stir gently to coat well with the manchurian sauce.▢ Garnish gobi manchurian with spring onion greens. Serve immediately as a appetizer or as a side with noodles or fried rice."
"['Basmati Rice Recipe, How to Cook Basmati Rice']",▢ 1 cup  aged basmati rice▢ 2 cups water reduce by ½ cup if using new rice▢ ½ teaspoon oil or ghee (optional)▢ ¼ to ½ teaspoon salt (optional),▢ Heat ghee in a wide pot and add the drained rice (completely no water). Increase the heat to high and stir fry the rice occasionally for 2 to 3 mins.▢ Pour water and bring it to a rolling boil. Reduce the heat and cover the pot. Let cook until all of the water is absorbed.▢ You have the fulffy basmati rice under 10 minutes.
['Veg Fried Rice Recipe (Vegetable Fried Rice)'],"Vegetables▢ ¼ to ½ cup Carrots chopped finely▢ ¼ cup Bell peppers (capsicum) chopped finely▢ ¼ cup French beans (4 to 5 green beans, chopped finely)▢ ¼ cup Green onions  (scallions/spring onions, 4 stalks, fine chopped)▢ ¼ cup Cabbage (optional, or ¾ cup mushrooms sliced )▢ 1 green chili slit (optional, for heat)","▢ Heat a wok with oil on the highest flame and fry chopped garlic slightly just for 30 to 40 seconds. ▢ Next add all the chopped vegetables and fry for 2 to 3 minutes just until half cooked. They should be crunchy and not soft.▢ Add soya sauce. Then add the optional ingredients vinegar and half tsp sugar. Sugar helps to preserve the bright colors of veggies and helps to balance the flavors.▢ Immediately add cooled rice, ¼ teaspoon salt and black pepper. Fry the vegetable fried rice for 2 mins. ▢ Garnish veg fried rice with fresh green onions. Tastes good on its own but you can also pair it with veg manchurian or chilli paneer."
['Ghee Rice Recipe'],Whole spices▢ 2 inch cinnamon (dalchini)▢ 4 cloves (laung)▢ 3 to 4 green cardamoms (elaichi)▢ 1 strand  mace (javitri)▢ 1 star anise (chakri phool)▢ 1 bay leaf (tej patta),"▢ Press the SAUTE button & add ghee to the inner steel pot of the Instant pot.▢ When the ghee melts, add the cashews & saute until they turn light golden.▢ Then add in the raisins and stir until they plum up. Remove the cashews and raisins to a small plate.▢ Stir in the onion slices to the ghee and spread them in a single layer.▢ Next stir them every now and then until they turn golden to light brown & aromatic. If the pot is too hot, you can switch the saute to low by pressing (saute button again). Drain the ghee well and remove to the same plate.▢ Now add in all the whole spices, followed by the green chilli and drained rice.▢ Saute for 30 to 60 seconds & press CANCEL button.▢ Pour water and add salt. Deglaze by scrubbing the bottom of the steel pot with a spatula. Taste the water and add more salt if needed.▢ Secure the instant pot with the lid. Position the steam release handle/ vent to sealing.▢ Press the PRESSURE COOK button (or manual on older IPs) and set the timer to 5 mins.▢ When the IP beeps, wait for natural pressure release for 2 to 3 mins. For softer rice, you can wait upto 5 mins. Then release the rest manually by moving the steam release handle from sealing to venting.▢ Cool down a bit and then garnish ghee rice with fried onions, raisins and cashews."
['Tomato Rice Recipe (Indian Style)'],whole spices (skip if you don't have)▢ 1 small bay leaf or curry leaves▢ ¾ teaspoon cumin seeds (jeera)▢ 1 inch cinnamon piece (dalchini)▢ 3 green cardamoms  (elaichi)▢ 3 cloves (laung),"▢ Soak rice for 30 mins. Press SAUTE button & pour oil to the inner pot of the instant pot. Then fry cashews until golden and remove them. Stir in the whole spices and then add onions. ▢ Saute them until transparent. Add the ginger garlic paste & saute for 30 seconds. Add tomatoes and salt. Saute them until the tomatoes break down and turn mushy. ▢ Add chilli powder, garam masala & turmeric. Saute for just 1 to 2 mins untilthe moisture from tomatoes almost dries up. ▢ Next pour 1¾ cups + 2 tbsp water. Press CANCEL button. Scrape off any bits of spices stuck at the bottom. This prevents from getting a burn notice. ▢ Stir & check the salt. Add more if needed. Then add the rice. Then secure the lid. Set the steam release handle/ value to sealing. Press PRESSURE COOK button (highpressure) for 5 mins.▢ When the tomato rice is done, Instant pot beeps. Wait for 2 mins & release the pressure manually with the help of a spoon by moving the steam release handle to venting from sealing. If you like softer rice then let the pressure release naturally for 7 to 8 mins. Then release the rest manually. ▢ Sprinkle coriander leaves & fluff up the tomato rice with a fork. Garnish with cashews."
['Khichdi Recipe'],optional ingredients▢ 1 medium carrot cubed▢ 8 french beans cut to 1 inch length▢ 1 small potato cubed,"▢ Press saute button (medium) on your Instant pot.  Pour ghee to the steel insert.▢ As soon as the ghee melts, add bay leaf and cumin seeds.▢ When cumin begins to sizzle add onions & chopped chili. ▢ Saute until onions turn transparent. Next add in ginger, hing, tomatoes, all veggies & turmeric. ▢ Saute for 2 to 3 mins until tomatoes turn mushy. ▢ Add drained rice & lentils. Saute them for another 2 to 3 mins. ▢ Next add salt & pour water. Deglaze the pot by scraping the bottom with a spatula to remove bits of food stuck in there if any. Mix well & taste the water. ▢ Add more salt if needed. Secure the lid & move the steam release handle to sealing.▢ Press the pressure cook or manual button (high pressure). Set the timer to 8 mins. Or you can also press porridge button & set timer to 9 mins. ▢ Once it is done, the instant pot beeps, then press cancel and switch off. ▢ Wait for a natural pressure release for 10 minutes & release the rest manually.▢ When the float valve drops, open the lid & stir gently.▢ If you like soupy khichdi, add some hot boiling water to bring to consistency you like. Saute for 1 minute if you prefer.▢ Top dal khichdi with little ghee & serve with pickle or papad or chutney."
['Jeera Rice Recipe (Cumin Rice)'],Whole spices▢ 2 teaspoons cumin seeds (jeera)▢ 1 bay leaf (tej patta)▢ 4 green cardamoms (elaichi)▢ 2 inch cinnamon piece (dalchini)▢ 4 cloves (laung)▢ 1 strand mace (javitri) (optional),"▢ Press saute button and pour ghee to the inner pot of instant pot. ▢ Add all the spices & saute for 1 min until they turn fragrant. Add the drained rice and chilli. Saute for 2 mins stirring occasionally. Do not stir a lot, rice grains will break.▢ Pour 1¾ cups plus 2 tbsps water and add salt. Stir and taste the water. If needed add more salt.▢ Secure the lid & position the steam release handle to sealing. ▢ Press the pressure cook button, set to high pressure. Set the timer for 5 mins. ▢ When done the instant pot beeps. Let the pressure release naturally for a min and release the rest of the pressure manually with the help of a long spoon (moving the vent from sealing to venting). This will give you al dente cooked jeera rice. (Do this always for a larger batch, even for softer rice, refer notes).▢ For softer rice, let the pressure release naturally for 3 to 4 mins. ▢ Fluff up the Jeera rice with a fork & add some coriander leaves. Serve with dal or your favorite curry."
['Gulab Jamun Recipe'],For Sugar Syrup▢ 1 ¼ to 1 ½ cups Sugar▢ 1 ½ cup water▢ 4 pods green cardamom  or ¼ tsp cardamom powder▢ 1 tsp rose water,"▢ Heat up the pan with ghee or oil on a medium heat. ▢ Also check if the syrup is hot. If it is not hot, heat it up a bit. It must be hot and not very hot.▢ To check the right temp, you can drop a small piece of dough in the oil. ▢ It must rise slowly without changing its color. ▢ If it rises rapidly then you will need to cool the oil a bit before frying.▢ When the ghee is just medium hot, add the balls. ▢ Make sure the oil is not very hot else the gulab jamuns will brown without cooking well. ▢ Fry the balls on a medium flame for 1 to 2 mins. Then regulate the flame to low flame & fry until golden. Keep stirring gently to fry them uniformly.▢ Add them to the hot syrup. Allow them to rest for 3 hours and serve. ▢ Garnish gulab jamun with chopped pistachios."
['Besan Ladoo Recipe'],"▢ 2 cup besan (1x – 210 to 220 grams gram flour)▢ ½ cup ghee (1x – 8 tbsps, 100 grams clarified butter)▢ 1 cup  sugar (adjust to taste) (or boora shakkar or powdered jaggery)▢ ⅔ teaspoon green cardamom powder (elaichi (or 4 to 6 cardamoms crushed/powdered)▢ 3 to 4 tablespoons cashews chopped (optional)","▢ When the besan cools down add powdered sugar. If you prefer less sweetness in your ladoos,  add little lesser than mentioned in the recipe. I use all of the powdered sugar.▢ Mix very well to combine the sugar. At first your mixture may seem dry but keep mixing or knead it with your hand. The warmth in your hand will melt the ghee and bind all of them well.▢ Take small portions of this and press down in your palm to roll to balls. You can make about 8 ladoos.▢ Store besan ladoo in a air tight jar at room temperature and use within 3 weeks. Alternately you can refrigerate them for up to 2 to 3 months. Reheat them in microwave for 15 to 20 seconds or in the oven at 80 C or 160 F for a few minutes until they become warm."
['Besan Burfi Recipe'],"▢ 210 grams besan (2 cup gram flour)▢ 2 tablespoon semolina (fine suji, refer notes)▢ 120 grams ghee (½ cup + 1½ tbsps)▢ ¾ teaspoon cardamom powder▢ 200 grams organic sugar (1 cup)▢ ½ cup water▢ 12 almonds or pistachios (chopped or sliced)","▢ Ensure besan has cooled down to slightly hot or warm temperature but the ghee is not solidified. The syrup is slightly hot & not boiling hot. If you put your finger in the syrup, you should feel it is hot and not warm. Check the picture in the step by step photo instructions so you don't go wrong at this stage. The syrup has to be all liquid and still hot.▢ Add cardamom powder to the besan and then pour half of the sugar syrup. ▢ Quickly mix both of them and then pour the rest of the syrup. Mix well. You have to be quick at this stage as the mixture will begin to thicken fast.▢ Immediately pour to the greased tray. Level it with the spatula and sprinkle chopped nuts. Press down with the spatula so the nuts stick to the besan burfi. ▢ It will begin to set immediately as it cools down depending on the temperature in your home. Mine took about 10 mins to cool down and set. Cut the burfi when it is slightly warm.▢ Transfer the besan burfi to a air tight jar. Store at room temperature and use up within 2 weeks."
['Kaju Katli Recipe (Kaju Barfi)'],"▢ 1½ cups cashew nuts (kaju – 200 grams)▢ 90 ml water (6 tablespoons, refer notes)▢ ¾  cup sugar  – 150 grams (refined white sugar is best, refer notes)▢ 1 teaspoon rose water or 1/8 teaspoon cardamom powder or both▢ 2 teaspoons ghee for cooking▢ 1 teaspoon ghee for greasing","▢ To check if the mixture is ready. Turn off the stove and set the pan aside. ▢ Take ¼ teaspoon of this kaju katli mixture and cool down a bit. ▢ Roll it to a ball with greased fingers. You must get a ball that isn't sticky. ▢ Upon cooling completely this has to get the texture of the katli or fudge.▢ Next transfer the cooked kaju katli mixture immediately to a greased plate or parchment paper (butter paper). ▢ Let the temperature come down to warm or slightly hot.▢ While the mixture is still slightly hot or warm, grease your palms and knead it for 2 to 3 minutes to a smooth crack free dough.  (refer video or picture below)▢ Another method is to place the mixture on parchment paper and cover it. Then knead it well with the paper over the mixture. Covering the mixture with parchment paper protects your palm from extreme heat.▢ ( To fix ) If your kaju katli mixture tends to stick a lot, it means it is still underdone. So continue to cook the mixture for a little longer. If your mixture looks dry, sprinkle some boiled and cooled water and knead.▢ Place the ball on a greased aluminum foil or a butter paper and cover it. ▢ With the help of a rolling pin, roll it evenly to ¼ inch thickness. ▢ Cool completely and cut to desired shapes. Store kaju katli in an airtight box."
['Kheer Recipe'],optional▢ 1 tablespoon ghee optional to fry nuts & raisins▢ 1 pinch saffron or 1 tsp edible rose water or kewra water,"▢ Press the saute button.▢ Optional – add ghee to the inner pot of the Instant pot. Fry the cashews until light golden. Add raisins and fry for 30 seconds. Remove to a plate.▢ Pour water (to avoid burn) and milk. Stir in rice and sugar.▢ Secure the lid of the instant pot. Position the steam release handle to sealing. Press the porridge button.▢ Set the timer to 18 mins. When it is done press cancel & switch off. Wait for the pressure to release naturally.▢ When the float valve drops, open the lid and stir in cardamom powder & rose water.▢ Rice kheer will be runny at this stage. For a thicker consistency cook on saute mode for a few mins until thick. It will thicken further after cooling.▢ Transfer kheer to serving bowls & garnish with nuts & raisins. You can also chill the rice kheer and serve."
['Jalebi recipe'],Equipment needed▢ 1 sauce bottle or Zip lock bag or cloth bag,"▢ Ensure oil is hot and the flame set to medium high heat. ▢ Squeeze in the batter gently in circular motions starting from the center moving outside. ▢ You can also do it the other way.  You will get properly shaped ones after making a few.▢ While the jalebi is getting fried, check the syrup. It must be slightly hot to warm when the jalebi is dipped into it. If not heat up a bit.▢ The last 1 minute, turn the flame to low and fry the jalebi. This helps to make them extra crisp.▢ When the jalebi is done it turns crisp. Remove it with a skewer and add to the warm sugar syrup directly.▢ Allow to rest for 2 mins. Remove to a plate. Continue to make more jalebis.▢ Serve jalebi hot."
['Chicken Tikka Masala Recipe'],For Garnish▢ 3 tablespoons heavy cream (or any cream)▢ 3 tablespoons coriander leaves (fine chopped),"▢ Grill in Oven : While the gravy simmers, thread the chicken to the metal skewers or soaked bamboo skewers and place them in a prepared tray. Bake them in a preheated oven at 460 F or 240 C for 9 to 10 mins. Turn them to the other side with a tong and grill then for another 9 to 10 mins. To char the chicken, broil for 2 to 3 mins or until slightly charred. ▢ Or In a Skillet: Pour 1 tbsp oil to a skillet and heat it well. Place the chicken tikka one by one, spacing them apart. Cook on a medium high heat for 3 mins, turn them to the other side with a tong and cook for another 3 mins, until charred and   not essentially fully cooked. Remove to a plate and Cook in batches.▢ Or In the Air fryer: Thread on skewers and place them in the basket or in the tray. Air fry for 6 mins, at 400 F or 200 C. Turn them with tongs and air fry for another 6 mins. If they dry out, you may baste with marinade and continue for another 2 mins, until slightly charred.▢ When the tikka masala turns thick, add sugar and the cream (or cashew cream, check notes to make your own). Stir well and cook for a few minutes until thick, creamy and aromatic. (Check video for consistency)▢ Add the grilled chicken tikka and crushed kasuri methi. (Make sure your gravy has reached a thick gravy consistency/serving consistency, before adding chicken). Stir and cook for 2 to 3 mins until chicken tikka is soft and tender. Taste test and add more salt, garam masala and sugar if needed.▢ Turn off and garnish with cream and coriander leaves. Serve chicken tikka masala with Butter Naan, roti, paratha, Basmati rice or Jeera rice."
['Chicken Biryani Recipe'],"Other ingredients for chicken biryani▢ 2 cups basmati rice (aged rice only)▢ 2 tablespoon ghee or Oil▢ 1 large onion  sliced thinly▢ ¼ to ½ cup mint leaves chopped fine (about 15 leaves)▢ 1 green chili (slit or chopped)▢ ¼ cup plain yogurt (Indian curd)▢ ¼ to ½ teaspoon red chili powder  (optional, for heat)▢ 1 teaspoon garam masala (or biryani masala)▢ 3 cups water (3½ cups for pot) (refer notes, more if needed )▢ ¾ teaspoon salt (to stir in water)▢ 2 tablespoon fried onions (optional)▢ 1 pinch saffron (optional)(soaked in 2 tbsps hot milk)","▢ Mix everything well and layer chicken evenly at the bottom. (check video)▢ Spread drained rice in a layer over the chicken.▢ To a separate pot, pour water. If cooking in a pot use more water.▢ Add salt and mix. Taste the water. It must be slightly salty. Bring this to a rolling boil.▢ Pour 2 cups of this water across the sides of the cooker or pot. Gently pour the rest on top of the rice. (check video)▢ Level the rice if needed. Sprinkle the rest of the mint leaves. Optionally add fried onions & saffron soaked milk if using.▢ Pot method – If cooking in a pot, cover and cook on a medium flame until the rice in the chicken biryani is cooked completely but not mushy or undercooked. If the rice is still under cooked or hard & there is no water at the bottom, pour ¼ to ½ cup more boiling water depending on the kind of rice used and cook further. When done it has to be fully cooked, yet remain grainy but not mushy.▢ Cooker method – Set the flame to medium high. Cover & place the whistle. Cook until you hear 1 whistle. Move the cooker away from the burner to stop cooking further. ▢ Rest until the pressure drops naturally. Fluff up the chicken biryani with a fork. ▢ Serve from top to the bottom layer. Each serving gets biryani rice from top and chicken from the bottom layer. ▢ Enjoy chicken biryani with raita and sliced veggies, papad and shorba (biryani gravy)."
['Butter Chicken Recipe (Indian Chicken Makhani)'],"For sauce▢ 2 to 3 tablespoons butter  or ghee (divided)▢ 2 inch cinnamon piece▢ 2 to 4 green cardamoms▢ 2 to 4 cloves▢ 1½ cups (130 grams) onions sliced (optional, *updated)▢ 3 cups (600 grams, 24 oz)  fresh tomato puree (or 1 cup passata/canned tomato puree)▢ ¾ tablespoon ginger garlic paste▢ 1 to 2 green chilies  (deseed, slit or chop, optional)▢ 28 (42 grams) whole raw cashews  (soaked in hot water if required, read notes)▢ ½ cup water  to blend (more if required)▢ 1 to 2 teaspoons Kashmiri chili powder  (reduce for kids, adjust to taste)▢ 1 to 1½ teaspoons garam masala  (divided, adjust to taste)▢ 1 to 1½ teaspoon coriander powder  (optional, adjust to taste)▢ ½ teaspoon cumin powder  (optional, adjust to taste)▢ ½ to ¾ teaspoon salt  (adjust to taste)▢ 1 teaspoon sugar  (to balance the flavors)▢ ½ tablespoon Kasuri methi  (dried fenugreek leaves)▢ 1½ cups hot water to make gravy▢ ⅓ cup (80 to 100 ml) heavy cream  or whipping cream (divided)▢ 2 tablespoons coriander leaves (fine chopped to garnish)","▢ Add chicken to the butter chicken gravy. Pour more hot water (about ½ cup, not in the recipe) if the sauce is too thick. Cover and simmer for about 5 to 7 minutes till it becomes tender.▢ Stir in salt, sugar and kasuri methi. Taste test and optionally add more garam masala & another tablespoon butter for additional flavour (both are optional).▢ Turn off and stir in the heavy cream. Garnish Butter Chicken with chopped coriander leaves and some cream. Serve with Turmeric rice, steamed Basmati Rice, Butter naan or Cumin Rice."
['Chicken Curry Recipe'],Whole spices (omit if you don't have)▢ 1 bay leaf or 1 sprig curry leaves▢ 4 cloves▢ 2 inch cinnamon piece▢ 3 green cardamom,"▢ Pour hot water just enough (about ½ cup) to make a thick gravy. As you cook, chicken lets out plenty of moisture, depending on that add more water. Check the pictures in the post for consistency.▢ Cover and cook on a medium flame till the chicken is soft cooked and the curry/gravy turns thick. When the chicken is cooked completely it will fall off the bone easily. ▢ Taste the curry & add more salt if needed. You can also add another ½ tsp garam masala at this stage if you feel it is less in flavors.▢ Lastly garnish with coriander leaves, cover and off the heat. Serve chicken curry with butter naan or jeera rice."
['Tandoori Chicken Recipe'],Mix to make red chili oil (or melted butter)▢ 1 teaspoon Kashmiri red chili powder▢ 1 to 2 tablespoon oil (preferably mustard oil),"▢ Preheat the oven to 470 F – 240 C. Place a wire rack over a baking tray, lined with foil for easy cleanup. Spray oil over the wire rack.▢ Arrange the marinated chicken on the rack. Roast/bake the chicken for a total of 25 to 30 mins (depending on the size of chicken), basting with chili oil/ melted butter after the first 12 to 15 mins. (Check at 12 mins mark)▢ Turn the chicken to the other side after basting and roast for another 12 to 15 minutes, followed by 2 to 3 minutes of broiling to get some charred spots. The timings can vary depending on your oven and the size of chicken. So adjust accordingly.▢ When the chicken is cooked through, an instant-read thermometer inserted into the thickest part should read 165 to 170 F (75 C). Optionally you may smoke the chicken following the steps in my post.▢ Brush the drippings or melted butter all over the chicken to keep it moist. Garnish with chopped coriander leaves. ▢ Serve with this Cilantro Chutney or Pudina Mint Chutney alongside onion and lemon wedges. For a complete meal, serve it with Turmeric rice, kachumber and Cucumber raita."
